{
  "doc_type": "proposal",
  "meta": {
    "title": "پیشنهاد پایلوت ارزیابی جریان پاسخ به سرنخ",
    "client_name": "شرکت نمونه‌ی آلفا (مشتری نمونه)",
    "doc_id": "PRP-ALFA-001",
    "revision": 1,
    "date": "۱۴۰۵/۰۷/۰۷",
    "calendar": "jalali",
    "valid_until": "۱۴۰۵/۰۸/۰۷",
    "status_note": "پیش‌نویس برای بررسی دامنه؛ قیمت پس از تأیید دامنه نهایی می‌شود",
    "prepared_by": "تیم مجری (نمونه)",
    "currency": "تومان",
    "sample": true
  },
  "sections": [
    {"id": "S01", "title": "مشخصات و کنترل نسخه", "blocks": [
      {"kind": "para", "text": "پیشنهاد پایلوت ارزیابی جریان پاسخ به سرنخ برای شرکت نمونه‌ی آلفا؛ نسخه‌ی ۱؛ تاریخ ۱۴۰۵/۰۷/۰۷ (تقویم شمسی)؛ اعتبار قیمت تا ۱۴۰۵/۰۸/۰۷. این نسخه برای بررسی دامنه است و قیمت آن پس از تأیید دامنه نهایی می‌شود."}
    ]},
    {"id": "S02", "title": "خلاصه اجرایی", "blocks": [
      {"kind": "para", "text": "تیم فروش شرکت نمونه‌ی آلفا پیش‌نویس پاسخ به سرنخ‌ها را دستی بازبینی می‌کند و مدیر فروش در جلسه‌ی کشف گفت این بازبینی گلوگاه پاسخ‌گویی است [C-01]."},
      {"kind": "para", "text": "پیشنهاد می‌کنیم ابتدا کیفیت و زمان بررسی پیش‌نویس‌ها را در یک پایلوت شش‌هفته‌ای محدود به یک کانال بسنجیم. اتصال CRM و ارسال خودکار خارج از این پایلوت است."},
      {"kind": "para", "text": "هزینه‌ی یک‌باره‌ی پایلوت ۱۵۰٬۰۰۰٬۰۰۰ تومان و پشتیبانی ماهانه ۱۲٬۰۰۰٬۰۰۰ تومان است. تصمیم توسعه پس از گزارش ارزیابی و هزینه‌ی مصرف گرفته می‌شود؛ گام بعد تأیید دامنه توسط مدیر فروش است."}
    ]},
    {"id": "S03", "title": "تشخیص و وضع موجود", "blocks": [
      {"kind": "para", "text": "طبق صورت‌جلسه‌ی کشف نیاز در ۱۴۰۵/۰۶/۳۰، هر پیش‌نویس پاسخ پیش از ارسال توسط یک کارشناس فروش بازبینی می‌شود [C-02]. زمان میانه‌ی این بازبینی هنوز اندازه‌گیری نشده است و ایجاد خط مبنای آن جزو تحویل فاز کشف است."},
      {"kind": "para", "text": "این مسئله فعلاً فقط در کانال ایمیل گزارش شده است؛ وضعیت کانال‌های دیگر هنوز بررسی نشده و در این پیشنهاد فرض نمی‌شود."}
    ]},
    {"id": "S04", "title": "نتایج و معیار سنجش", "blocks": [
      {"kind": "para", "text": "موفقیت پیش از اجرا تعریف می‌شود. هدف عددی هر شاخص پس از مشاهده‌ی خط مبنا با مالک فروش توافق می‌شود و تا آن زمان تعهد پذیرش نیست."},
      {"kind": "ref", "data": "metrics", "caption": "شاخص‌های پیشنهادی"}
    ]},
    {"id": "S05", "title": "راه‌حل و منطق انتخاب", "blocks": [
      {"kind": "para", "text": "برای کاهش زمان بازبینی، پیش‌نویس کنار شواهد سرنخ نمایش داده می‌شود تا کارشناس بتواند مبنای پیام را بررسی کند. این روش انتخاب شد چون مسئله‌ی گزارش‌شده بازبینی است، نه نوشتن [C-01]."},
      {"kind": "para", "text": "محدودیت: پیش‌نویس ممکن است ادعای نادرست داشته باشد؛ کنترل آن بازبینی انسانی پیش از هر ارسال و گزارش خطا در مجموعه‌ی آزمون است. هیچ پیامی بدون تأیید انسان ارسال نمی‌شود."}
    ]},
    {"id": "S06", "title": "دامنه و تحویل‌دادنی‌ها", "blocks": [
      {"kind": "para", "text": "دامنه‌ی پایلوت: یک کانال (ایمیل)، حداکثر ۳ کاربر فروش و مجموعه‌ی آزمون توافق‌شده."},
      {"kind": "ref", "data": "deliverables", "caption": "تحویل‌دادنی‌ها"},
      {"kind": "list", "items": ["اتصال CRM", "ارسال خودکار پیام", "کانال‌های غیر از ایمیل"], "ordered": false}
    ]},
    {"id": "S07", "title": "فرایند و زمان‌بندی", "blocks": [
      {"kind": "para", "text": "ارزیابی فقط پس از تثبیت مجموعه‌ی آزمون و دسترسی آزمایشی آغاز می‌شود؛ تأخیر در این دو مورد برنامه را جابه‌جا می‌کند."},
      {"kind": "ref", "data": "timeline", "caption": "برنامه‌ی وابستگی‌محور (روز کاری)"}
    ]},
    {"id": "S08", "title": "نقش‌ها و شیوه همکاری", "blocks": [
      {"kind": "ref", "data": "roles", "caption": "مجری، تأییدکننده و زمان پاسخ"}
    ]},
    {"id": "S09", "title": "قیمت و شرایط تجاری", "blocks": [
      {"kind": "ref", "data": "pricing", "caption": "اقلام قیمت"},
      {"kind": "ref", "data": "payments", "caption": "رویدادهای پرداخت"},
      {"kind": "para", "text": "هزینه‌ی API جدا محاسبه می‌شود؛ سقف مصرف و اقدام هنگام رسیدن به سقف پیش از شروع توافق می‌شود."}
    ]},
    {"id": "S10", "title": "فرض‌ها، استثناها و تغییر دامنه", "blocks": [
      {"kind": "list", "items": ["برآورد با فرض دسترسی آزمایشی به صندوق ایمیل فروش تا روز کاری ۵ است.", "اتصال CRM خارج از پایلوت است؛ پس از بررسی API، دامنه و هزینه جدا پیشنهاد می‌شود.", "هر تغییر دامنه با ثبت اثر بر قیمت و زمان و تأیید کتبی مدیر فروش پیش از اجرا انجام می‌شود."], "ordered": false}
    ]},
    {"id": "S11", "title": "امنیت و حریم خصوصی", "blocks": [
      {"kind": "para", "text": "پیش از پایلوت، فهرست داده‌های مجاز و سرویس‌های پردازشگر با مسئول داده‌ی مشتری تأیید می‌شود؛ محتوای محرمانه بدون این تأیید وارد مدل نمی‌شود. نگهداری داده‌ی آزمون تا پایان پایلوت است و حذف آن با تأیید مسئول داده انجام می‌شود. این کنترل‌ها برنامه‌ریزی‌شده‌اند و هنوز اجرا نشده‌اند."}
    ]},
    {"id": "S12", "title": "ریسک و کنترل", "blocks": [
      {"kind": "ref", "data": "risks", "caption": "ریسک‌های اصلی"}
    ]},
    {"id": "S13", "title": "پذیرش و تحویل نهایی", "blocks": [
      {"kind": "para", "text": "در آزمون پذیرش، هیچ مسیر ارسال بدون تأیید انسانی مجاز نیست؛ سایر آستانه‌های کیفیت با داده‌ی پایلوت توافق می‌شوند."},
      {"kind": "ref", "data": "acceptance", "caption": "معیار پذیرش هر تحویل"}
    ]},
    {"id": "S14", "title": "توان اجرا و نمونه مرتبط", "blocks": [
      {"kind": "para", "text": "نمونه‌ی قابل بررسی ما یک جریان تحلیل و پیش‌نویس با تأیید انسانی است که در جلسه‌ی کشف نمایش داده شد [C-03]. نتایج تجاری مشتریان قبلی در این سند ادعا نمی‌شود."}
    ]},
    {"id": "S15", "title": "گام بعد و وضعیت توافق", "blocks": [
      {"kind": "para", "text": "گام بعد، تأیید دامنه‌ی پایلوت و تعیین مسئول داده توسط مدیر فروش تا ۱۴۰۵/۰۷/۱۴ است؛ سپس قیمت و برنامه‌ی نهایی برای توافق بررسی می‌شود. شروع کار پس از تأیید دامنه، دسترسی آزمایشی و توافق مکتوب است."}
    ]}
  ],
  "data": {
    "deliverables": [
      {"id": "D-01", "title": "سند معیارهای ارزیابی و مجموعه‌ی آزمون", "detail": "معیارهای پذیرش پیش‌نویس و مجموعه‌ی ثابت نمونه‌ها با برچسب مالک فروش", "format": "سند Markdown + فایل داده", "due": "پایان روز کاری ۱۰", "need": "سنجش کیفیت", "acceptance": "A-01"},
      {"id": "D-02", "title": "گزارش ارزیابی پایلوت", "detail": "نتیجه‌ی اجرای مجموعه‌ی آزمون، خطاها و زمان بازبینی در برابر خط مبنا", "format": "گزارش PDF متنی", "due": "پایان روز کاری ۲۵", "need": "تصمیم توسعه", "acceptance": "A-02"},
      {"id": "D-03", "title": "راهنما و آموزش کاربران", "detail": "راهنمای کار با جریان بازبینی و یک جلسه‌ی آموزشی برای ۳ کاربر", "format": "راهنمای Markdown + جلسه‌ی آنلاین", "due": "پایان روز کاری ۳۰", "need": "ادامه‌ی کار تیم", "acceptance": "A-03"}
    ],
    "acceptance": [
      {"id": "A-01", "deliverable": "D-01", "test": "بازبینی سند و نمونه‌ها توسط مالک فروش", "data": "مجموعه‌ی نمونه‌ی ثابت", "threshold": "تأیید برچسب همه‌ی نمونه‌ها توسط مالک فروش", "critical_error": "نمونه‌ی بدون برچسب", "reviewer": "مدیر فروش", "fix_window": "۳ روز کاری", "retest": "بازبینی دوباره‌ی موارد اصلاح‌شده"},
      {"id": "A-02", "deliverable": "D-02", "test": "اجرای مجموعه‌ی آزمون ثابت و مقایسه با خط مبنا", "data": "مجموعه‌ی نمونه‌ی ثابت + خط مبنای فاز کشف", "threshold": "هیچ مسیر ارسال بدون تأیید انسانی؛ آستانه‌های کیفیت پس از خط مبنا توافق می‌شود", "critical_error": "ارسال بدون تأیید", "reviewer": "مدیر فروش", "fix_window": "۵ روز کاری", "retest": "اجرای دوباره‌ی کامل مجموعه"},
      {"id": "A-03", "deliverable": "D-03", "test": "اجرای یک سناریو توسط یک کاربر مشتری بدون کمک مجری", "data": null, "threshold": "انجام کامل سناریو", "critical_error": null, "reviewer": "مسئول عملیات فروش", "fix_window": "۳ روز کاری", "retest": "تکرار سناریو"}
    ],
    "pricing": {
      "currency": "تومان",
      "tax_note": "مبالغ بدون مالیات بر ارزش افزوده است؛ مالیات طبق قانون جدا محاسبه می‌شود.",
      "items": [
        {"id": "P-01", "title": "کشف و خط مبنا", "basis": "دامنه‌ی ثابت فاز کشف", "amount": 60000000, "kind": "one_time", "period": null, "note": null},
        {"id": "P-02", "title": "پیکربندی و ارزیابی پایلوت", "basis": "دامنه‌ی ثابت پایلوت", "amount": 90000000, "kind": "one_time", "period": null, "note": null},
        {"id": "P-03", "title": "پشتیبانی پس از پایلوت", "basis": "ماهانه، حداکثر ۸ ساعت", "amount": 12000000, "kind": "recurring", "period": "ماهانه", "note": "اختیاری"}
      ],
      "totals": {"one_time": 150000000, "recurring": 12000000},
      "payments": [
        {"id": "PAY-01", "event": "امضای توافق دامنه", "deliverable": null, "percent": 40},
        {"id": "PAY-02", "event": "پذیرش گزارش ارزیابی پایلوت", "deliverable": "D-02", "percent": 60}
      ],
      "usage_cap": "سقف مصرف API پیش از شروع توافق می‌شود؛ هنگام رسیدن به ۸۰٪ سقف به مشتری اطلاع داده می‌شود.",
      "separate_costs": ["هزینه‌ی مصرف API مدل، طبق تعرفه‌ی جاری ارائه‌دهنده"],
      "tariff_assumption": "تعرفه‌ی API در زمان شروع از منبع جاری ارائه‌دهنده وارد می‌شود.",
      "validity": "تا ۱۴۰۵/۰۸/۰۷"
    },
    "timeline": [
      {"id": "T-01", "stage": "کشف", "prerequisite": "دسترسی به مدیر فروش و نمونه‌ها", "duration_workdays": 10, "output": "خط مبنا و D-01", "approver": "مدیر فروش", "delay_effect": "عقب‌افتادن برآورد نهایی"},
      {"id": "T-02", "stage": "پیکربندی و ارزیابی", "prerequisite": "D-01 پذیرفته‌شده و دسترسی آزمایشی", "duration_workdays": 15, "output": "D-02", "approver": "مدیر فروش", "delay_effect": "جابه‌جایی پذیرش"},
      {"id": "T-03", "stage": "تحویل و آموزش", "prerequisite": "D-02 پذیرفته‌شده", "duration_workdays": 5, "output": "D-03", "approver": "مسئول عملیات فروش", "delay_effect": "تغییر شروع بهره‌برداری"}
    ],
    "metrics": [
      {"id": "M-01", "name": "زمان میانه‌ی بازبینی هر پیش‌نویس پذیرفته‌شده", "formula": "میانه‌ی دقیقه‌ی بازبینی ÷ پیش‌نویس‌های پذیرفته‌شده", "baseline": "در فاز کشف اندازه‌گیری می‌شود", "target": "پس از مشاهده‌ی خط مبنا توافق می‌شود", "period": "دوره‌ی پایلوت", "method": "ثبت زمان در جریان بازبینی", "owner": "مدیر فروش"},
      {"id": "M-02", "name": "نسبت پیش‌نویس‌های نیازمند بازنویسی کامل", "formula": "پیش‌نویس‌های بازنویسی‌شده ÷ کل پیش‌نویس‌ها", "baseline": "در فاز کشف اندازه‌گیری می‌شود", "target": "پس از مشاهده‌ی خط مبنا توافق می‌شود", "period": "دوره‌ی پایلوت", "method": "برچسب کارشناس بازبین", "owner": "مدیر فروش"}
    ],
    "risks": [